{
  "schema_version": "startup_opportunity.ai_trigger_source_binding_policy.current",
  "policy_id": "startup_opportunity.ai_trigger_source_binding",
  "policy_version": "1.0.0",
  "base_adaptation_policy_binding": {
    "policy_ref": "harness/policies/adaptation.current.json",
    "schema_version": "startup_opportunity.adaptation_policy.current",
    "policy_version": "1.0.0",
    "content_hash": "sha256:b91cb152dd62a6cc2dee5c4688184f29b7ff3aef7543e242430b818bb324d102"
  },
  "contract_versions": {
    "planning_context": "startup_opportunity.planning_context.ai_source_bound.current",
    "source_attestation": "startup_opportunity.ai_trigger_source_attestation.v1",
    "trigger": "startup_opportunity.ai_mandatory_coverage_trigger.v1"
  },
  "source_resolution": "explicit_document_bundle_path",
  "source_content_hash_algorithm": "canonical_json_sha256.v1",
  "required_exact_bindings": [
    "run_id",
    "mode",
    "planning_context.context_id",
    "planning_context.revision",
    "subject_ref",
    "trigger.trigger_version",
    "trigger.signal",
    "trigger.declared_value"
  ],
  "stale_on_change": ["source_ref", "source_schema_version", "source_content_hash", "exact_binding"]
}
